{
  "event_id": "9b2e6f7a-3c41-4d58-8a7b-1f2e3d4c5b6a",
  "event_type": "analysis.review_requested",
  "event_version": "1.0",
  "occurred_at": "2026-06-15T09:46:00Z",
  "data": {
    "review_id": "a1b2c3d4-e5f6-4071-8293-a4b5c6d7e8f9",
    "analysis_result_id": "b2c3d4e5-f6a7-4182-93a4-b5c6d7e8f9a0",
    "mission_id": "c3d4e5f6-a7b8-4293-a4b5-c6d7e8f9a0b1",
    "field_id": "d4e5f6a7-b8c9-43a4-b5c6-d7e8f9a0b1c2",
    "job_id": "e5f6a7b8-c9d0-44b5-c6d7-e8f9a0b1c2d3",
    "dataset_id": "f6a7b8c9-d0e1-45c6-d7e8-f9a0b1c2d3e4",
    "analysis_type": "HEALTH",
    "crop_type": "COTTON",
    "confidence_score": 0.82
  },
  "metadata": {
    "correlation_id": "corr_mission_123",
    "causation_id": "7a8b9c0d-1e2f-4031-8243-5a6b7c8d9e0f",
    "source_service": "platform-worker-bridge"
  }
}
